{
  "run_id": "RUN-716785f0-c913-439a-9e8d-6e782fe8d221",
  "project_id": "PROJECT-VT",
  "scan_time": "2026-05-31T08:21:36.032963Z",
  "evidences": [
    {
      "evidence_id": "EVIDENCE-VT-001",
      "source_type": "task",
      "source_path": "docs/task_list.json",
      "covers": [
        "AC-VT-001-01",
        "REQ-VT-001"
      ],
      "status": "covered",
      "details": {
        "task_id": "TASK-VT-001",
        "title": "Implement Feature",
        "phase_id": "PHASE-VT-001",
        "priority": "must"
      }
    },
    {
      "evidence_id": "EVIDENCE-VT-002",
      "source_type": "claim",
      "source_path": ".vibetracing/agent_claims.json",
      "covers": [
        "AC-VT-001-01",
        "REQ-VT-001"
      ],
      "status": "covered",
      "details": {
        "claim_id": "CLAIM-VT-001",
        "related_task": "TASK-VT-001",
        "timestamp": "2030-05-22T12:00:00Z",
        "notes": ""
      }
    },
    {
      "evidence_id": "EVIDENCE-VT-003",
      "source_type": "test",
      "source_path": "tests/test_unrelated.py::test_something_else",
      "covers": [
        "AC-VT-999-99"
      ],
      "status": "covered",
      "details": {
        "nodeid": "tests/test_unrelated.py::test_something_else",
        "outcome": "passed",
        "command": "pytest --json-report",
        "exit_code": 0
      }
    }
  ]
}